"concept_id","found_from","concept_name","domain_id","vocabulary_id","standard_concept"
200962,"From initial search","Primary malignant neoplasm of prostate","Condition","SNOMED","standard"
36712762,"From initial search","Recurrent malignant neoplasm of prostate","Condition","SNOMED","standard"
44502000,"From initial search","Neoplasm, malignant of prostate gland","Condition","ICDO3","standard"
4163261,"From initial search","Malignant tumor of prostate","Condition","SNOMED","standard"
36519333,"From initial search","Solitary fibrous tumor, malignant of prostate gland","Condition","ICDO3","standard"
4200890,"From initial search","Local recurrence of malignant tumor of prostate","Condition","SNOMED","standard"
36536835,"From initial search","Malignant peripheral nerve sheath tumor, NOS, of prostate gland","Condition","ICDO3","standard"
4082919,"From descendants","Endometrioid carcinoma of prostate","Condition","SNOMED","standard"
4116087,"From descendants","Carcinoma of prostate","Condition","SNOMED","standard"
4161028,"From descendants","Adenocarcinoma of prostate","Condition","SNOMED","standard"
36517801,"From descendants","Superficial spreading adenocarcinoma of prostate gland","Condition","ICDO3","standard"
36519069,"From descendants","Schneiderian carcinoma of prostate gland","Condition","ICDO3","standard"
36519743,"From descendants","Adenocarcinoma in tubulovillous adenoma of prostate gland","Condition","ICDO3","standard"
36520216,"From descendants","Cloacogenic carcinoma of prostate gland","Condition","ICDO3","standard"
36520903,"From descendants","Adenocarcinoma with cartilaginous and osseous metaplasia of prostate gland","Condition","ICDO3","standard"
36522940,"From descendants","Malignant fibrous histiocytoma of prostate gland","Condition","ICDO3","standard"
36525240,"From descendants","Rhabdoid tumor, NOS, of prostate gland","Condition","ICDO3","standard"
36528487,"From descendants","Basaloid carcinoma of prostate gland","Condition","ICDO3","standard"
36529044,"From descendants","Papillary carcinoma, NOS, of prostate gland","Condition","ICDO3","standard"
36533689,"From descendants","Pleomorphic carcinoma of prostate gland","Condition","ICDO3","standard"
36535056,"From descendants","Adenocarcinoma with squamous metaplasia of prostate gland","Condition","ICDO3","standard"
36538788,"From descendants","Adenocarcinoma in villous adenoma of prostate gland","Condition","ICDO3","standard"
36538823,"From descendants","Epithelioma, malignant of prostate gland","Condition","ICDO3","standard"
36539709,"From descendants","Solid carcinoma, NOS, of prostate gland","Condition","ICDO3","standard"
36540664,"From descendants","Adenoid cystic carcinoma of prostate gland","Condition","ICDO3","standard"
36543338,"From descendants","Villous adenocarcinoma of prostate gland","Condition","ICDO3","standard"
36543398,"From descendants","Urothelial carcinoma, micropapillary of prostate gland","Condition","ICDO3","standard"
36547882,"From descendants","Myoepithelial carcinoma of prostate gland","Condition","ICDO3","standard"
36550618,"From descendants","Scirrhous adenocarcinoma of prostate gland","Condition","ICDO3","standard"
36550817,"From descendants","Alveolar adenocarcinoma of prostate gland","Condition","ICDO3","standard"
36551411,"From descendants","Oxyphilic adenocarcinoma of prostate gland","Condition","ICDO3","standard"
36552560,"From descendants","Adenocarcinoma with apocrine metaplasia of prostate gland","Condition","ICDO3","standard"
36553778,"From descendants","Verrucous carcinoma, NOS, of prostate gland","Condition","ICDO3","standard"
36554139,"From descendants","Tubular adenocarcinoma of prostate gland","Condition","ICDO3","standard"
36555690,"From descendants","Epithelial-myoepithelial carcinoma of prostate gland","Condition","ICDO3","standard"
36556099,"From descendants","Metaplastic carcinoma, NOS, of prostate gland","Condition","ICDO3","standard"
36563396,"From descendants","Lymphoepithelial carcinoma of prostate gland","Condition","ICDO3","standard"
36564577,"From descendants","Duct carcinoma, desmoplastic type of prostate gland","Condition","ICDO3","standard"
36566340,"From descendants","Medullary carcinoma, NOS, of prostate gland","Condition","ICDO3","standard"
36566722,"From descendants","Carcinoma, anaplastic, NOS, of prostate gland","Condition","ICDO3","standard"
37016740,"From descendants","Prostate cancer metastatic to bone","Condition","SNOMED","standard"
37311236,"From descendants","Infiltrating duct carcinoma of prostate","Condition","SNOMED","standard"
42511841,"From descendants","Extra-adrenal paraganglioma, NOS, of prostate gland","Condition","ICDO3","standard"
42512260,"From descendants","Sebaceous carcinoma of prostate gland","Condition","ICDO3","standard"
42512377,"From descendants","Paget disease, extramammary of prostate gland","Condition","ICDO3","standard"
42512655,"From descendants","Mixed acinar-ductal carcinoma of prostate gland","Condition","ICDO3","standard"
44499514,"From descendants","Infiltrating duct carcinoma, NOS, of prostate gland","Condition","ICDO3","standard"
44499641,"From descendants","Papillary adenocarcinoma, NOS, of prostate gland","Condition","ICDO3","standard"
44499685,"From descendants","Adenocarcinoma, NOS, of prostate gland","Condition","ICDO3","standard"
44499712,"From descendants","Carcinoma, undifferentiated, NOS, of prostate gland","Condition","ICDO3","standard"
44499734,"From descendants","Papillary urothelial carcinoma of prostate gland","Condition","ICDO3","standard"
44500595,"From descendants","Adenocarcinoma with mixed subtypes of prostate gland","Condition","ICDO3","standard"
44501350,"From descendants","Mucinous adenocarcinoma of prostate gland","Condition","ICDO3","standard"
44501528,"From descendants","Mucin-producing adenocarcinoma of prostate gland","Condition","ICDO3","standard"
44501544,"From descendants","Hemangiopericytoma, malignant of prostate gland","Condition","ICDO3","standard"
44503133,"From descendants","Carcinoma, NOS, of prostate gland","Condition","ICDO3","standard"
44503145,"From descendants","Cribriform carcinoma, NOS, of prostate gland","Condition","ICDO3","standard"
44503555,"From descendants","Intraductal papillary adenocarcinoma with invasion of prostate gland","Condition","ICDO3","standard"
44503558,"From descendants","Adenosquamous carcinoma of prostate gland","Condition","ICDO3","standard"
764971,"From descendants","Prostate cancer metastatic to eye","Condition","SNOMED","standard"
4141960,"From descendants","Hormone refractory prostate cancer","Condition","SNOMED","standard"
4283738,"From descendants","Malignant tumor involving prostate by direct extension from bladder","Condition","SNOMED","standard"
36540985,"From descendants","Choriocarcinoma, NOS, of prostate gland","Condition","ICDO3","standard"
36544648,"From descendants","Yolk sac tumor, NOS, of prostate gland","Condition","ICDO3","standard"
36547431,"From descendants","Seminoma, NOS, of prostate gland","Condition","ICDO3","standard"
36554563,"From descendants","Teratocarcinoma of prostate gland","Condition","ICDO3","standard"
36684947,"From descendants","Metastatic castration-resistant prostate cancer","Condition","SNOMED","standard"
36716186,"From descendants","Hormone sensitive prostate cancer","Condition","SNOMED","standard"
37395835,"From descendants","Familial prostate cancer","Condition","SNOMED","standard"
608748,"From initial search","Percentage of primary malignant neoplasm of prostate in resected prostate specimen","Observation","SNOMED","standard"
618650,"From initial search","Presence of direct invasion by primary malignant neoplasm of prostate to neck of male bladder","Observation","SNOMED","standard"
619810,"From initial search","Histologic type of primary malignant neoplasm of prostate","Observation","SNOMED","standard"
4297952,"From initial search","Presence of direct invasion by primary malignant neoplasm of prostate to periprostatic tissue","Observation","SNOMED","standard"
3181293,"From initial search","Histologic type of primary malignant neoplasm of prostate","Observation","Nebraska Lexicon","standard"
602144,"From initial search","Presence of direct invasion by primary malignant neoplasm of prostate to seminal vesicle","Observation","SNOMED","standard"
602258,"From initial search","Anatomic location directly invaded by primary malignant neoplasm of prostate","Observation","SNOMED","standard"
602259,"From initial search","Gleason pattern of primary malignant neoplasm of prostate at surgical margin of prostatectomy specimen","Observation","SNOMED","standard"
602269,"From initial search","Histologic grade of primary malignant neoplasm of prostate by International Society of Urological Pathology technique","Observation","SNOMED","standard"
43531388,"From initial search","Educated about screening for malignant neoplasm of prostate","Observation","SNOMED","standard"
