"concept_id","found_from","concept_name","domain_id","vocabulary_id","standard_concept"
44501580,"From descendants","Mucinous carcinoma, gastric type of cervix uteri","Condition","ICDO3","standard"
44501641,"From descendants","Adenocarcinoma in tubulovillous adenoma of cervix uteri","Condition","ICDO3","standard"
44501802,"From descendants","Adenocarcinoma, endocervical type, NOS, of endocervix","Condition","ICDO3","standard"
44501939,"From descendants","Mixed cell adenocarcinoma of endocervix","Condition","ICDO3","standard"
44502096,"From descendants","Adenocarcinoma, intestinal type of cervix uteri","Condition","ICDO3","standard"
44502392,"From descendants","Clear cell adenocarcinoma, NOS, of endocervix","Condition","ICDO3","standard"
44502445,"From descendants","Endometrioid adenocarcinoma, NOS, of cervix uteri","Condition","ICDO3","standard"
44502472,"From descendants","High grade serous carcinoma of cervix uteri","Condition","ICDO3","standard"
44502558,"From descendants","Mullerian mixed tumor of cervix uteri","Condition","ICDO3","standard"
44502575,"From descendants","Adenosquamous carcinoma of endocervix","Condition","ICDO3","standard"
44502690,"From descendants","Squamous cell carcinoma, NOS, of endocervix","Condition","ICDO3","standard"
44504292,"From descendants","Carcinoma, NOS, of endocervix","Condition","ICDO3","standard"
44504294,"From descendants","Adenocarcinoma, NOS, of endocervix","Condition","ICDO3","standard"
44504300,"From descendants","Carcinoma, NOS, of exocervix","Condition","ICDO3","standard"
44504306,"From descendants","Carcinoma, NOS, of cervix uteri","Condition","ICDO3","standard"
44504309,"From descendants","Adenocarcinoma, NOS, of cervix uteri","Condition","ICDO3","standard"
44504310,"From descendants","Adenosquamous carcinoma of cervix uteri","Condition","ICDO3","standard"
